{
"schema":"catalyst.evo-c-transformation-catalogue.v1",
"schema_version":1,
"catalogue":{"identity":"catalyst.evo.c.ast-transformations","version":1},
"ast_evidence_schema_version":1,
"source_edit_schema_version":1,
"entries":[
{"identity":"catalyst.evo.c.assignment-to-compound","version":1,"allowed_location_kinds":["spelling"],"parameter_schemas":[{"identity":"operator","kind":"choice","required":true,"minimum_integer":null,"maximum_integer":null,"choices":["add","bitwise-and","bitwise-or","bitwise-xor","multiply","subtract"]}],"preconditions":["ast-provider-v1","comments-outside-target","same-nonvolatile-identifier-lvalue","spelling-location-only"],"dependencies":[],"conflicts":[],"capability":{"provider_contract_version":1,"ast_forms":["assignment-binary","assignment-compound"],"formatting_policy":"canonical-c17-spaces-v1","idempotence_policy":"already-satisfied-no-change-v1","semantic_assumptions":["assignment-and-rhs-reference-the-same-declaration","compound-assignment-preserves-the-provider-resolved-c-type","lvalue-is-a-plain-nonvolatile-identifier","target-is-a-spelling-range-without-comments-or-directives"],"validation_obligations":["baseline-build","baseline-correctness","c17-syntax","sanitizers"],"unsupported":{"comments":"reject","macros":"reject","language_extensions":"reject","alias_assumptions":"reject"}}},
{"identity":"catalyst.evo.c.double-negation-condition","version":1,"allowed_location_kinds":["spelling"],"parameter_schemas":[{"identity":"context","kind":"choice","required":true,"minimum_integer":null,"maximum_integer":null,"choices":["do-while","for","if","while"]}],"preconditions":["ast-provider-v1","scalar-controlling-expression","spelling-location-only","target-free-of-comments"],"dependencies":[],"conflicts":[],"capability":{"provider_contract_version":1,"ast_forms":["double-negated-condition","scalar-condition"],"formatting_policy":"preserve-operand-spelling-v1","idempotence_policy":"already-satisfied-no-change-v1","semantic_assumptions":["operand-is-a-c-scalar-controlling-expression","removing-double-negation-preserves-truth-testing","target-is-a-spelling-range-without-comments-or-directives"],"validation_obligations":["baseline-build","baseline-correctness","c17-syntax","sanitizers"],"unsupported":{"comments":"reject","macros":"reject","language_extensions":"reject","alias_assumptions":"reject"}}},
{"identity":"catalyst.evo.c.unsigned-multiply-to-shift","version":1,"allowed_location_kinds":["spelling"],"parameter_schemas":[{"identity":"maximum-shift","kind":"integer","required":true,"minimum_integer":1,"maximum_integer":63,"choices":[]}],"preconditions":["ast-provider-v1","spelling-location-only","target-free-of-comments","unsigned-result-type-preserved"],"dependencies":[],"conflicts":[],"capability":{"provider_contract_version":1,"ast_forms":["unsigned-multiply-power-of-two","unsigned-shift-power-of-two"],"formatting_policy":"parenthesized-c17-shift-v1","idempotence_policy":"already-satisfied-no-change-v1","semantic_assumptions":["literal-is-a-decimal-c17-integer-constant","multiplication-result-is-an-unsigned-integer","power-of-two-shift-is-less-than-the-result-width","shift-result-type-matches-the-multiplication-result-type","target-is-a-spelling-range-without-comments-or-directives"],"validation_obligations":["baseline-build","baseline-correctness","c17-syntax","sanitizers"],"unsupported":{"comments":"reject","macros":"reject","language_extensions":"reject","alias_assumptions":"reject"}}}
],
"human_readable_abstraction":{"reference_form":"stable-capability-arrays-and-direct-dispatch","projection":"complete-catalogue-json-and-derived-markdown","complete":true,"probabilistic_authority":false}
}
